{
  "endpoint": "https://otel.falak.example:4318",
  "headers": { "Authorization": "Bearer otlp-secret" },
  "resource": { "org_id": "01J9ZQ4C5M8W3X2Y1V0T9S8R7Q", "server_id": "01J9ZQ4C5M8W3X2Y1V0T9S8R7P", "environment": "production" },
  "sampling": { "traces_ratio": 0.25 },
  "sites": [
    { "slug": "shop-example-com", "site_id": "01J9ZQ4C5M8W3X2Y1V0T9S8R7N", "environment": "production",
      "deployment_id": "01J9ZQ4C5M8W3X2Y1V0T9S8R7M", "release_id": "01J9ZQ4C5M8W3X2Y1V0T9S8R7K", "unix_user": "shop", "runtime": "php-fpm" }
  ],
  "log_sources": [
    { "path": "/srv/falak/sites/shop-example-com/shared/storage/logs/*.log", "site": "shop-example-com", "format": "plain" },
    { "path": "/var/log/caddy/access.log", "service": "caddy", "format": "json" }
  ],
  "docker_logs": { "enabled": true, "label_selector": { "falak.managed": "true" } },
  "metrics": { "enabled": true, "interval_s": 15 },
  "insights": { "enabled": true },
  "buffer_max_bytes": 67108864
}
